[
  {
    "id": "genesis",
    "name": "Genesis",
    "startYear": 4000,
    "endYear": 1805,
    "era": "BC",
    "category": "Pentateuch",
    "priority": 1,
    "track": "books",
    "description": "Creation, Fall, Flood, Patriarchs",
    "author": "Moses (traditional)",
    "dateRange": "Creation - 1805 BC",
    "relatedPeople": [
      "abraham",
      "terah",
      "sarah",
      "isaac",
      "ishmael",
      "adam",
      "eve",
      "noah",
      "jacob",
      "joseph"
    ],
    "relatedEvents": [
      "flood",
      "call-of-abraham",
      "creation",
      "the-fall",
      "tower-of-babel",
      "ishmael-born",
      "birth-of-isaac",
      "twelve-tribes-of-israel",
      "josephs-exaltation-in-egypt"
    ],
    "sources": [
      "Hindson & Yates, The Essence of the Old Testament (B&H Academic, 2012)",
      "Walton, Chronological and Background Charts of the Old Testament (Zondervan, 1994)"
    ]
  },
  {
    "id": "exodus-book",
    "name": "Exodus",
    "startYear": 1446,
    "endYear": 1406,
    "era": "BC",
    "category": "Pentateuch",
    "priority": 1,
    "track": "books",
    "description": "Israel's deliverance from Egypt and receiving the Law at Sinai",
    "author": "Moses",
    "dateRange": "1446-1406 BC",
    "relatedPeople": [
      "moses",
      "amram",
      "jochebed",
      "zipporah",
      "gershom",
      "eliezer"
    ],
    "relatedEvents": [
      "exodus",
      "mosaic-covenant"
    ],
    "sources": [
      "Hindson & Yates, The Essence of the Old Testament (B&H Academic, 2012)",
      "Walton, Chronological and Background Charts of the Old Testament (Zondervan, 1994)"
    ]
  },
  {
    "id": "leviticus",
    "name": "Leviticus",
    "startYear": 1446,
    "endYear": 1406,
    "era": "BC",
    "category": "Pentateuch",
    "priority": 2,
    "track": "books",
    "description": "Laws for holiness, worship, sacrifices, and priestly ministry.",
    "author": "Moses",
    "dateRange": "1446-1406 BC",
    "relatedPeople": [
      "moses"
    ],
    "relatedEvents": [],
    "sources": [
      "Hindson & Yates, The Essence of the Old Testament (B&H Academic, 2012)",
      "Walton, Chronological and Background Charts of the Old Testament (Zondervan, 1994)"
    ]
  },
  {
    "id": "numbers",
    "name": "Numbers",
    "startYear": 1446,
    "endYear": 1406,
    "era": "BC",
    "category": "Pentateuch",
    "priority": 2,
    "track": "books",
    "description": "Wilderness journey, censuses, rebellion, and preparation to enter Canaan.",
    "author": "Moses",
    "dateRange": "1446-1406 BC",
    "relatedPeople": [
      "moses"
    ],
    "relatedEvents": [],
    "sources": [
      "Hindson & Yates, The Essence of the Old Testament (B&H Academic, 2012)",
      "Walton, Chronological and Background Charts of the Old Testament (Zondervan, 1994)"
    ]
  },
  {
    "id": "deuteronomy",
    "name": "Deuteronomy",
    "startYear": 1406,
    "endYear": 1406,
    "era": "BC",
    "category": "Pentateuch",
    "priority": 2,
    "track": "books",
    "description": "Moses final covenant sermons before Israel enters the land.",
    "author": "Moses",
    "dateRange": "1406 BC",
    "relatedPeople": [
      "moses"
    ],
    "relatedEvents": [],
    "sources": [
      "Hindson & Yates, The Essence of the Old Testament (B&H Academic, 2012)",
      "Walton, Chronological and Background Charts of the Old Testament (Zondervan, 1994)"
    ]
  },
  {
    "id": "1-samuel",
    "name": "1 Samuel",
    "startYear": 1100,
    "endYear": 1010,
    "era": "BC",
    "category": "History",
    "priority": 2,
    "track": "books",
    "description": "Transition from judges to monarchy; Saul reign and David rise.",
    "author": "Samuel, Gad, Nathan (traditional)",
    "dateRange": "1100-1010 BC",
    "relatedPeople": [
      "samuel"
    ],
    "relatedEvents": [
      "selection-of-king-saul"
    ],
    "sources": [
      "Hindson & Yates, The Essence of the Old Testament (B&H Academic, 2012)",
      "Walton, Chronological and Background Charts of the Old Testament (Zondervan, 1994)"
    ]
  },
  {
    "id": "2-samuel",
    "name": "2 Samuel",
    "startYear": 1010,
    "endYear": 970,
    "era": "BC",
    "category": "History",
    "priority": 2,
    "track": "books",
    "description": "David reign over Israel, covenant promise, victories, and failures.",
    "author": "Gad, Nathan (traditional)",
    "dateRange": "1010-970 BC",
    "relatedPeople": [],
    "relatedEvents": [
      "reign-of-king-david"
    ],
    "sources": [
      "Hindson & Yates, The Essence of the Old Testament (B&H Academic, 2012)",
      "Walton, Chronological and Background Charts of the Old Testament (Zondervan, 1994)"
    ]
  },
  {
    "id": "1-kings",
    "name": "1 Kings",
    "startYear": 970,
    "endYear": 853,
    "era": "BC",
    "category": "History",
    "priority": 2,
    "track": "books",
    "description": "Solomon reign, temple construction, and division of the kingdom.",
    "author": "Jeremiah (traditional)",
    "dateRange": "970-853 BC",
    "relatedPeople": [],
    "relatedEvents": [
      "temple-built",
      "reign-of-king-david",
      "division-of-the-kingdom"
    ],
    "sources": [
      "Hindson & Yates, The Essence of the Old Testament (B&H Academic, 2012)",
      "Walton, Chronological and Background Charts of the Old Testament (Zondervan, 1994)"
    ]
  },
  {
    "id": "2-kings",
    "name": "2 Kings",
    "startYear": 853,
    "endYear": 586,
    "era": "BC",
    "category": "History",
    "priority": 2,
    "track": "books",
    "description": "History of divided kingdoms through exile and Jerusalem destruction.",
    "author": "Jeremiah (traditional)",
    "dateRange": "853-586 BC",
    "relatedPeople": [],
    "relatedEvents": [
      "fall-of-northern-kingdom",
      "destruction-of-jerusalem"
    ],
    "sources": [
      "Hindson & Yates, The Essence of the Old Testament (B&H Academic, 2012)",
      "Walton, Chronological and Background Charts of the Old Testament (Zondervan, 1994)"
    ]
  },
  {
    "id": "jeremiah",
    "name": "Jeremiah",
    "startYear": 627,
    "endYear": 580,
    "era": "BC",
    "category": "Major Prophets",
    "priority": 2,
    "track": "books",
    "description": "Prophetic warnings, calls to repentance, and hope amid coming judgment.",
    "author": "Jeremiah",
    "dateRange": "627-580 BC",
    "relatedPeople": [],
    "relatedEvents": [
      "destruction-of-jerusalem"
    ],
    "sources": [
      "Hindson & Yates, The Essence of the Old Testament (B&H Academic, 2012)",
      "Walton, Chronological and Background Charts of the Old Testament (Zondervan, 1994)"
    ]
  },
  {
    "id": "ezra",
    "name": "Ezra",
    "startYear": 538,
    "endYear": 457,
    "era": "BC",
    "category": "History",
    "priority": 2,
    "track": "books",
    "description": "Return from exile and restoration of worship and covenant life.",
    "author": "Ezra",
    "dateRange": "538-457 BC",
    "relatedPeople": [],
    "relatedEvents": [
      "return-from-exile",
      "dedication-of-second-temple"
    ],
    "sources": [
      "Hindson & Yates, The Essence of the Old Testament (B&H Academic, 2012)",
      "Walton, Chronological and Background Charts of the Old Testament (Zondervan, 1994)"
    ]
  },
  {
    "id": "nehemiah",
    "name": "Nehemiah",
    "startYear": 445,
    "endYear": 430,
    "era": "BC",
    "category": "History",
    "priority": 2,
    "track": "books",
    "description": "Rebuilding Jerusalem walls and spiritual reform in Judah.",
    "author": "Nehemiah",
    "dateRange": "445-430 BC",
    "relatedPeople": [],
    "relatedEvents": [
      "rebuilding-jerusalems-walls"
    ],
    "sources": [
      "Hindson & Yates, The Essence of the Old Testament (B&H Academic, 2012)",
      "Walton, Chronological and Background Charts of the Old Testament (Zondervan, 1994)"
    ]
  },
  {
    "id": "joshua",
    "name": "Joshua",
    "startYear": 1406,
    "endYear": 1375,
    "era": "BC",
    "category": "History",
    "priority": 2,
    "track": "books",
    "description": "Conquest and settlement of the Promised Land under Joshua.",
    "author": "Joshua (traditional)",
    "dateRange": "1406-1375 BC",
    "relatedPeople": [
      "joshua"
    ],
    "relatedEvents": [
      "conquest-of-canaan"
    ],
    "sources": [
      "Hindson & Yates, The Essence of the Old Testament (B&H Academic, 2012)",
      "Walton, Chronological and Background Charts of the Old Testament (Zondervan, 1994)"
    ]
  },
  {
    "id": "judges",
    "name": "Judges",
    "startYear": 1375,
    "endYear": 1050,
    "era": "BC",
    "category": "History",
    "priority": 2,
    "track": "books",
    "description": "Cycles of sin, oppression, and deliverance through judges.",
    "author": "Samuel (traditional)",
    "dateRange": "1375-1050 BC",
    "relatedPeople": [],
    "relatedEvents": [],
    "sources": [
      "Hindson & Yates, The Essence of the Old Testament (B&H Academic, 2012)",
      "Walton, Chronological and Background Charts of the Old Testament (Zondervan, 1994)"
    ]
  },
  {
    "id": "ruth",
    "name": "Ruth",
    "startYear": 1150,
    "endYear": 1100,
    "era": "BC",
    "category": "History",
    "priority": 2,
    "track": "books",
    "description": "Story of loyalty and redemption in the time of judges.",
    "author": "Samuel (traditional)",
    "dateRange": "1150-1100 BC",
    "relatedPeople": [],
    "relatedEvents": [],
    "sources": [
      "Hindson & Yates, The Essence of the Old Testament (B&H Academic, 2012)",
      "Walton, Chronological and Background Charts of the Old Testament (Zondervan, 1994)"
    ]
  },
  {
    "id": "1-chronicles",
    "name": "1 Chronicles",
    "startYear": 1010,
    "endYear": 970,
    "era": "BC",
    "category": "History",
    "priority": 2,
    "track": "books",
    "description": "Genealogies and David's reign from a priestly perspective.",
    "author": "Ezra (traditional)",